{
  "schema_version": "1.0.0",
  "registry_version": "1.0.0",
  "baseline_revision": "d28547da5286eb7f275a74449d88d398018de8e4",
  "generated_from": "docs/spec/25_TZ_REQUIREMENTS_PRIORITIZATION_PIPELINE.md#25.5",
  "source_inventory": [
    {
      "path": "docs/tz/*.md",
      "role": "CANONICAL_SSoT",
      "notes": "Канонические разделы ТЗ, включая восстановленный и принятый §2."
    },
    {
      "path": "docs/architecture/[0-9][0-9]_*.md",
      "role": "CANONICAL_SSoT",
      "notes": "Профильные архитектурные SSoT."
    },
    {
      "path": "docs/spec/*.md",
      "role": "CANONICAL_SSoT",
      "notes": "Канонические спецификации исполнения, безопасности, QA, интеграций и engineering process."
    },
    {
      "path": "schemas/v1/*.json",
      "role": "MACHINE_CONTRACT",
      "notes": "Физический SSoT материализованных машинных контрактов v1."
    },
    {
      "path": "schemas/README.md",
      "role": "CONTROL_PROCESS",
      "notes": "Формат, версия и правила каталога схем."
    },
    {
      "path": "modules_registry.json",
      "role": "RESPONSIBILITY_MAP",
      "notes": "Машинное представление материализованных модулей; не заменяет логическую карту §27."
    },
    {
      "path": "docs/architecture/KAT9I_OS_ARCHITECTURE_CONTEXT.md",
      "role": "TRACEABILITY",
      "notes": "Исторический архитектурный snapshot; не конкурирующий SSoT."
    },
    {
      "path": "docs/architecture/MODULE_RESPONSIBILITY_MAP.md",
      "role": "TRACEABILITY",
      "notes": "Предшествующая карта; текущая ownership-карта — §27."
    },
    {
      "path": "AGENTS.md",
      "role": "CONTROL_PROCESS",
      "notes": "Правила разработки и Owner Gate."
    },
    {
      "path": "docs/GITHUB_WORKFLOW.md",
      "role": "CONTROL_PROCESS",
      "notes": "Рабочий GitHub-процесс проекта."
    },
    {
      "path": "config/architecture_convergence_policy.json",
      "role": "GATE_ROADMAP",
      "notes": "Machine policy Architecture Convergence."
    },
    {
      "path": ".github/workflows/quality.yml",
      "role": "GATE_ROADMAP",
      "notes": "Детерминированный Quality Gate."
    },
    {
      "path": ".github/workflows/project-queue-sync.yml",
      "role": "CONTROL_PROCESS",
      "notes": "Производная синхронизация Project lifecycle."
    },
    {
      "path": "index.html",
      "role": "DERIVED",
      "notes": "Производное HTML-представление Markdown, не SSoT."
    }
  ],
  "requirements": [
    {
      "requirement_id": "REQ-SYS-001",
      "title": "Назначение и базовая архитектура KAT9I_OS",
      "area": "System",
      "type": "ARCHITECTURE",
      "canonical_ssot": "docs/tz/01-naznachenie-i-bazovaya-arhitektura.md",
      "canonical_owner": "Architecture governance",
      "target_gate": "G1",
      "target_version": "Architecture Baseline",
      "status": "ACCEPTED",
      "dependencies": [],
      "machine_contract_refs": [],
      "evidence_refs": [],
      "issue_refs": [
        "#62"
      ],
      "coverage_status": "COVERED",
      "abc": "UNASSESSED",
      "xyz": "UNASSESSED",
      "materialization": "NOT_APPLICABLE"
    },
    {
      "requirement_id": "REQ-CORE-001",
      "title": "Core как управляющее ядро и координатор жизненного цикла",
      "area": "Core",
      "type": "RESPONSIBILITY",
      "canonical_ssot": "docs/tz/02-core-arhitekturnaya-karta-i-operacionnaya-model.md",
      "canonical_owner": "Core",
      "target_gate": "G1/G3",
      "target_version": "v0.1",
      "status": "ACCEPTED",
      "dependencies": [
        "REQ-TASK-001",
        "REQ-RULES-001",
        "REQ-SEC-001"
      ],
      "machine_contract_refs": [
        "schemas/v1/TaskContract.json",
        "schemas/v1/TaskRuntimeState.json"
      ],
      "evidence_refs": [
        "modules_registry.json#Core"
      ],
      "issue_refs": [],
      "coverage_status": "COVERED",
      "abc": "UNASSESSED",
      "xyz": "UNASSESSED",
      "materialization": "MATERIALIZED",
      "runtime_module_ref": "modules_registry.json#Core",
      "supporting_refs": [
        "docs/architecture/27_MODULE_REGISTRY_AND_RESPONSIBILITY_MAP.md#27.4"
      ]
    },
    {
      "requirement_id": "REQ-TASK-001",
      "title": "TaskContract и TaskRuntimeState разделены и типизированы",
      "area": "Core / Task",
      "type": "CONTRACT",
      "canonical_ssot": "docs/architecture/03_TASK_CONTRACT.md",
      "canonical_owner": "Core",
      "target_gate": "G2",
      "target_version": "v0.1",
      "status": "ACCEPTED",
      "dependencies": [
        "REQ-CONTRACTS-001"
      ],
      "machine_contract_refs": [
        "schemas/v1/TaskContract.json",
        "schemas/v1/TaskRuntimeState.json",
        "schemas/v1/TaskResult.json"
      ],
      "evidence_refs": [],
      "issue_refs": [
        "#40"
      ],
      "coverage_status": "COVERED",
      "abc": "UNASSESSED",
      "xyz": "UNASSESSED",
      "materialization": "MATERIALIZED",
      "runtime_module_ref": "modules_registry.json#Core",
      "supporting_refs": [
        "docs/architecture/26_INTERNAL_CONTRACTS.md#26.10"
      ]
    },
    {
      "requirement_id": "REQ-LIFECYCLE-001",
      "title": "Task проходит явный управляемый lifecycle от intake до проверенного результата",
      "area": "Core / Lifecycle",
      "type": "PROCESS",
      "canonical_ssot": "docs/architecture/20_TASK_LIFECYCLE_AND_ORCHESTRATION.md",
      "canonical_owner": "Core",
      "target_gate": "G3",
      "target_version": "v0.1",
      "status": "ACCEPTED",
      "dependencies": [
        "REQ-TASK-001",
        "REQ-RULES-001",
        "REQ-SEC-001",
        "REQ-QA-001",
        "REQ-EVIDENCE-001"
      ],
      "machine_contract_refs": [
        "schemas/v1/TaskContract.json",
        "schemas/v1/TaskRuntimeState.json",
        "schemas/v1/SecurityDecision.json",
        "schemas/v1/Evidence.json"
      ],
      "evidence_refs": [],
      "issue_refs": [],
      "coverage_status": "COVERED",
      "abc": "UNASSESSED",
      "xyz": "UNASSESSED",
      "materialization": "LOGICAL_ONLY",
      "supporting_refs": [
        "docs/architecture/03_TASK_CONTRACT.md",
        "docs/architecture/26_INTERNAL_CONTRACTS.md"
      ]
    },
    {
      "requirement_id": "REQ-RULES-001",
      "title": "Единый Rule Manager и Effective Ruleset с deny wins",
      "area": "Rules",
      "type": "RESPONSIBILITY",
      "canonical_ssot": "docs/architecture/04_RULES_AND_EXECUTION_PRIORITIES.md",
      "canonical_owner": "Rule Manager",
      "target_gate": "G1/G3",
      "target_version": "v0.1",
      "status": "ACCEPTED",
      "dependencies": [
        "REQ-CONTRACTS-001"
      ],
      "machine_contract_refs": [],
      "evidence_refs": [
        "modules_registry.json#RuleManager"
      ],
      "issue_refs": [],
      "coverage_status": "CONTRACT_GAP",
      "coverage_notes": "§26 объявляет Effective Ruleset/RulesRef устойчивыми контрактами, но отдельной физической схемы v1 для них нет.",
      "abc": "UNASSESSED",
      "xyz": "UNASSESSED",
      "materialization": "MATERIALIZED",
      "runtime_module_ref": "modules_registry.json#RuleManager",
      "supporting_refs": [
        "docs/architecture/27_MODULE_REGISTRY_AND_RESPONSIBILITY_MAP.md#27.5"
      ]
    },
    {
      "requirement_id": "REQ-SEC-001",
      "title": "Security является единственным владельцем Permission и Capability Grant",
      "area": "Security",
      "type": "SECURITY",
      "canonical_ssot": "docs/spec/14_SECURITY.md",
      "canonical_owner": "Security",
      "target_gate": "G2/G3",
      "target_version": "v0.1",
      "status": "ACCEPTED",
      "dependencies": [
        "REQ-RULES-001",
        "REQ-IDENTITY-001"
      ],
      "machine_contract_refs": [
        "schemas/v1/SecurityDecision.json",
        "schemas/v1/CapabilityGrant.json",
        "schemas/v1/ApprovalRecord.json",
        "schemas/v1/SecretRef.json"
      ],
      "evidence_refs": [
        "modules_registry.json#Security"
      ],
      "issue_refs": [
        "#44",
        "#45"
      ],
      "coverage_status": "COVERED",
      "abc": "UNASSESSED",
      "xyz": "UNASSESSED",
      "materialization": "MATERIALIZED",
      "runtime_module_ref": "modules_registry.json#Security",
      "supporting_refs": [
        "docs/architecture/27_MODULE_REGISTRY_AND_RESPONSIBILITY_MAP.md#27.6"
      ]
    },
    {
      "requirement_id": "REQ-IDENTITY-001",
      "title": "Identity и Human Approval имеют машинную fail-closed модель",
      "area": "Security / Identity",
      "type": "CONTRACT",
      "canonical_ssot": "docs/spec/14_SECURITY.md#14.13",
      "canonical_owner": "Security",
      "target_gate": "G2",
      "target_version": "v0.1",
      "status": "ACCEPTED",
      "dependencies": [],
      "machine_contract_refs": [
        "schemas/v1/Identity.json",
        "schemas/v1/ApprovalRecord.json"
      ],
      "evidence_refs": [],
      "issue_refs": [
        "#44"
      ],
      "coverage_status": "COVERED",
      "abc": "UNASSESSED",
      "xyz": "UNASSESSED",
      "materialization": "MATERIALIZED",
      "supporting_refs": [
        "docs/architecture/32_ARCHITECTURAL_DECISIONS_AND_OPEN_QUESTIONS.md"
      ]
    },
    {
      "requirement_id": "REQ-DOMAIN-001",
      "title": "Domain владеет предметной семантикой Skills, Workflows и Validators",
      "area": "Domain",
      "type": "RESPONSIBILITY",
      "canonical_ssot": "docs/spec/16_DOMAINS.md",
      "canonical_owner": "Domain",
      "target_gate": "G1",
      "target_version": "v0.3+",
      "status": "ACCEPTED",
      "dependencies": [
        "REQ-CORE-001"
      ],
      "machine_contract_refs": [],
      "evidence_refs": [],
      "issue_refs": [],
      "coverage_status": "COVERED",
      "abc": "UNASSESSED",
      "xyz": "UNASSESSED",
      "materialization": "LOGICAL_ONLY",
      "supporting_refs": [
        "docs/architecture/27_MODULE_REGISTRY_AND_RESPONSIBILITY_MAP.md#27.7"
      ]
    },
    {
      "requirement_id": "REQ-SKILL-001",